<?xml version="1.0" encoding="UTF-8"?>
<!--

    Copyright 2014 deib-polimi
    Contact: deib-polimi <marco.miglierina@polimi.it>

       Licensed under the Apache License, Version 2.0 (the "License");
       you may not use this file except in compliance with the License.
       You may obtain a copy of the License at

           http://www.apache.org/licenses/LICENSE-2.0

       Unless required by applicable law or agreed to in writing, software
       distributed under the License is distributed on an "AS IS" BASIS,
       WITHOUT WARRANTIES OR CONDITIONS OF ANY KIND, either express or implied.
       See the License for the specific language governing permissions and
       limitations under the License.

-->
<monitoringRules
	xmlns="http://www.modaclouds.eu/xsd/1.0/monitoring_rules_schema"
	xmlns:xsi="http://www.w3.org/2001/XMLSchema-instance"
	xsi:schemaLocation="http://www.modaclouds.eu/xsd/1.0/monitoring_rules_schema ../monitoringrules/monitoring_rules_schema.xsd">
	<monitoringRule id="mr-61310618-1da0-4c7a-aa1b-14a2a45d8a70"
		label="ResponseTime" metricName="ResponseTime"
		relatedQosConstraintId="c1" startEnabled="true" timeStep="60"
		timeWindow="60" samplingProbability="1" samplingTime="10">
		<monitoredTargets>
			<monitoredTarget klass="_GdmYEMhsEeKON4DtRoKCMw" />
		</monitoredTargets>
		<metricAggregation groupingCategoryName="CloudProvider"
			aggregateFunction="Average" />
		<condition>METRIC &gt; 2000.0</condition>
		<actions>
			<action name="OutputMetric">
				<parameter name="name">ResponseTimeAvgViolation</parameter>
			</action>
		</actions>
	</monitoringRule>
	<monitoringRule id="mr-57c0287c-fd59-4d19-8030-625395cd35bf"
		label="ResponseTime" metricName="ResponseTime"
		relatedQosConstraintId="c2" startEnabled="true" timeStep="60"
		timeWindow="60" samplingProbability="1" samplingTime="10">
		<monitoredTargets>
			<monitoredTarget klass="_GdmYEMhsEeKON4DtRoKCMw" />
		</monitoredTargets>
		<metricAggregation groupingCategoryName="CloudProvider"
			aggregateFunction="Percentile">
			<parameter name="thPercentile">95</parameter>
		</metricAggregation>
		<condition>METRIC &gt; 3000.0</condition>
		<actions>
			<action name="OutputMetric">
				<parameter name="name">ResponseTimePercViolation</parameter>
			</action>
		</actions>
	</monitoringRule>
</monitoringRules>